{
  "fixtureId": "cards.ledger_simulation_placeholder",
  "kind": "cards_ledger",
  "lineage": {
    "canonicality": "PLACEHOLDER",
    "mtrScope": "N_A",
    "notes": "Simulation-gated balance mutations; live issuer settlement is uncertified by default."
  },
  "sourceEvidence": [
    "coinline/backend/src/HostPlatform.Cards/CardLedgerCapabilities.cs",
    "coinline/backend/src/HostPlatform.Infrastructure/Cards/CardAccountLedger.cs"
  ],
  "expectedParse": {
    "defaultSimulation": true
  },
  "expectedDiagnostics": []
}
