{
  "fixtureId": "craft.channel_placeholder",
  "kind": "craft_transport",
  "lineage": {
    "canonicality": "PLACEHOLDER",
    "mtrScope": "N_A",
    "notes": "Simulation transport is implemented (CraftSimulationTransport); live modem attach remains uncertified."
  },
  "sourceEvidence": [
    "coinline/backend/src/HostPlatform.Craft/CraftTransportCapabilities.cs",
    "coinline/backend/src/HostPlatform.Infrastructure/Craft/CraftSimulationTransport.cs"
  ],
  "expectedParse": {
    "defaultSimulation": true,
    "liveAttachNoticeContains": "HARDWARE_VALIDATION_REQUIRED"
  },
  "expectedDiagnostics": []
}
